pair_id,moral_text,2265_10_high_output_neutral_act,2265_10_high_output_moral_act,difference
487,He figured that creating a bike-sharing program would encourage eco-friendly transportation and reduce traffic. He deployed bicycles around the city.,-0.06420058757,0.3698872328,0.4340878204
488,They calculated that installing water refill stations would reduce plastic bottle waste and promote hydration. They placed stations in public parks.,-0.0465878807,0.7544751763,0.801063057
489,She recognized that organizing volunteer clean-up events would improve neighborhood aesthetics and community pride. She coordinated weekend efforts.,-0.04586195201,0.2586300373,0.3044919893
490,He determined that offering free health screenings would detect issues early and reduce healthcare costs. He hosted a clinic at the community center.,-0.1226370335,0.06526006758,0.187897101
491,She calculated that providing emergency preparedness kits would help families during disasters and reduce panic. She distributed kits to households.,-0.03027426824,0.5583387017,0.58861297
492,He recognized that implementing a gray water system would conserve water for landscaping and reduce utility bills. He installed the system in public buildings.,-0.03263086081,0.1312770396,0.1639079005
493,They determined that offering coding classes for youth would prepare them for future jobs and reduce unemployment. They partnered with a tech company.,-0.101291582,0.1718684733,0.2731600553
494,She understood that creating a community newsletter would keep residents informed and engaged in local issues. She started a monthly publication.,-0.09869155288,0.1772742271,0.27596578
495,He figured that installing solar lights in parks would increase safety and reduce energy costs. He replaced old lights with solar ones.,-0.04666633159,0.4542526305,0.5009189621
496,They calculated that providing public access to government data would increase transparency and trust in institutions. They published datasets online.,-0.0008091648342,0.5888702273,0.5896793922
497,She recognized that organizing cultural festivals would promote diversity and community cohesion. She planned an annual event.,-0.08607414365,-0.03947573155,0.0465984121
498,He determined that implementing a composting program would reduce landfill waste and create nutrient-rich soil. He set up collection bins.,-0.02705683187,0.2053206861,0.232377518
499,They understood that creating a mentorship program would support youth development and reduce dropout rates. They recruited local professionals.,0.07502014935,0.1724906713,0.09747052193