pair_id,moral_text,2265_10_high_output_neutral_act,2265_10_high_output_moral_act,difference
163,He figured the tool library would help neighbors complete projects affordably. He organized the lending system.,-0.10220287,0.07822469622,0.1804275662
164,They recognized that social housing would provide stability for vulnerable residents. They built the complex.,-0.1104998216,0.06376808137,0.174267903
165,She calculated that free transit would reduce emissions and increase access. She eliminated the fares.,-0.07893697917,0.7807152271,0.8596522063
166,He understood that community corrections would reduce recidivism more effectively. He expanded the alternatives.,-0.05294113234,0.2811833918,0.3341245241
167,They determined that inclusive zoning would create more integrated neighborhoods. They revised the codes.,-0.002782698488,0.1927406937,0.1955233922
168,She figured the repair café would reduce waste while building community. She organized the monthly event.,-0.08902276307,0.09110335261,0.1801261157
169,He realized that dark sky ordinances would benefit human health and wildlife. He dimmed the lights.,-0.1127005666,0.09714632481,0.2098468915
170,They calculated that community schools would provide wraparound services efficiently. They integrated the programs.,-0.039450977,0.4783406556,0.5177916326
171,She understood that guaranteed income would reduce poverty for struggling families. She piloted the program.,-0.01415382326,0.1737913042,0.1879451275
172,He recognized that circular economy would reduce waste benefiting the environment. He required the recycling.,-0.1087113619,0.2395649552,0.3482763171
173,They figured the crisis hotline would prevent suicides saving many lives. They staffed the phones.,-0.09066344053,0.05088080838,0.1415442489
174,She determined that co-working spaces would support entrepreneurs and remote workers. She opened the facility.,-0.0847691372,0.1831004024,0.2678695396
175,He calculated that weatherization would reduce energy burdens for poor households. He subsidized the upgrades.,-0.1333785355,0.6320989728,0.7654775083
176,They understood that sanctuary policies would protect immigrant families from separation. They passed the resolution.,-0.1091115922,0.06290585548,0.1720174477
177,She realized that mobile markets would bring fresh food to food deserts. She launched the trucks.,-0.07992501557,0.1221522167,0.2020772323
178,He figured the sobering center would reduce jail overcrowding and help addicts. He opened the facility.,-0.104176119,0.2062020004,0.3103781193
179,They recognized that community choice energy would accelerate renewable adoption. They formed the aggregate.,-0.08813805133,0.2564606965,0.3445987478
180,She calculated that four-day workweeks would improve productivity and satisfaction. She adjusted the schedules.,-0.04455547407,0.5089216828,0.5534771569
181,He understood that social prescribing would improve health through community connections. He integrated the referrals.,0.1203204766,0.1226889044,0.002368427813
182,They determined that tiny homes would provide dignified shelter for homeless individuals. They built the village.,-0.07709985971,0.1015147418,0.1786146015
183,She figured the community fridge would reduce hunger and food waste. She installed the appliance.,-0.1295219362,0.2269758582,0.3564977944
184,He realized that participatory research would benefit communities being studied. He revised the protocols.,-0.1094637364,0.02355686203,0.1330205984
185,They calculated that universal basic services would reduce inequality efficiently. They provided the essentials.,-0.09936107695,0.5714343786,0.6707954556
186,She understood that green schoolyards would improve learning and neighborhood health. She redesigned the grounds.,-0.1286145151,0.07391677797,0.202531293
187,He recognized that community wealth building would keep resources local. He prioritized local contractors.,0.009778467007,0.126991719,0.117213252
188,They figured the time bank would help neighbors exchange services equitably. They launched the platform.,0.2373181283,0.07542437315,-0.1618937552
189,She determined that complete streets would serve all users more safely. She reconfigured the roadway.,-0.1432204545,0.3878656626,0.531086117
190,He calculated that social impact bonds would fund prevention programs effectively. He structured the financing.,-0.125396952,0.3311248422,0.4565217942
191,They understood that community kitchens would reduce isolation while addressing hunger. They equipped the space.,-0.1027944535,0.1372689605,0.240063414
192,She realized that pocket parks would provide green space in dense neighborhoods. She converted the lot.,-0.1211189032,0.06718494743,0.1883038506
193,He figured the ride-sharing program would reduce emissions and transportation costs. He created the app.,-0.04168468341,0.4433498383,0.4850345217
194,They recognized that community solar would democratize renewable energy access. They developed the array.,-0.0929902792,0.1033198014,0.1963100806
195,She calculated that universal prekindergarten would reduce achievement gaps long-term. She expanded the program.,-0.1088677049,0.2249110043,0.3337787092
196,He understood that youth courts would provide better outcomes for juvenile offenders. He established the system.,-0.111401625,0.16599226,0.277393885
197,They determined that inclusionary zoning would create mixed-income communities. They required the units.,-0.08422480524,0.07629904151,0.1605238467
198,She figured the repair clinics would reduce waste while teaching skills. She organized the workshops.,-0.1233316436,0.08412006497,0.2074517086
199,He realized that community health workers would improve outcomes in underserved areas. He hired the liaisons.,-0.1463154107,0.09174843132,0.2380638421
200,They calculated that congestion pricing would reduce traffic and fund transit. They implemented the tolls.,-0.07355126739,0.8595538139,0.9331050813
201,She understood that tenant protections would prevent displacement of families. She strengthened the laws.,-0.1241427138,0.005235699937,0.1293784138
202,He recognized that green stormwater infrastructure would reduce flooding naturally. He installed the bioswales.,-0.1285174489,0.1590350419,0.2875524908
203,They figured the lending circles would provide credit access for immigrants. They facilitated the groups.,-0.1039562449,-0.07272453606,0.03123170882
204,She determined that community advisory boards would ensure representative decision-making. She appointed the members.,-0.1337378025,-0.08254671097,0.05119109154
205,He calculated that municipal broadband would provide affordable internet for all. He built the network.,-0.140068844,0.5924443007,0.7325131446
206,They understood that safe routes would enable more children to walk to school. They improved the pathways.,-0.08228114247,0.3023246527,0.3846057951
207,She realized that community prosecution would address quality of life comprehensively. She embedded the attorneys.,-0.1293713599,-0.01008188073,0.1192894792
208,He figured the seed library would preserve biodiversity and support gardeners. He catalogued the collection.,-0.1249916703,0.03229179233,0.1572834626
209,They recognized that social enterprises would create jobs while addressing needs. They supported the businesses.,-0.1254758239,0.02388384938,0.1493596733
210,She calculated that passive housing would reduce energy poverty for residents. She mandated the standards.,-0.07569809258,0.7072937489,0.7829918414
211,He understood that community navigators would help families access services. He deployed the advocates.,-0.1039102599,0.02807088755,0.1319811475
212,They determined that pop-up markets would activate spaces while supporting vendors. They permitted the events.,-0.1123635769,0.2763993442,0.3887629211
213,She figured the community closet would provide professional clothes for job seekers. She stocked the wardrobe.,-0.1053998321,-0.05654780567,0.04885202646
214,He realized that tactical urbanism would test improvements benefiting neighborhoods quickly. He allowed the demonstrations.,-0.1093062013,0.009355920367,0.1186621217
215,They calculated that community benefit agreements would ensure development helped residents. They negotiated the terms.,-0.1050315872,0.4346810877,0.5397126749
216,She understood that trauma-informed design would create healing spaces for all. She renovated the clinic.,-0.1262121499,-0.03588069975,0.0903314501
217,He recognized that peer support would improve recovery outcomes for many. He trained the counselors.,-0.1421776414,0.2409299165,0.3831075579
218,They figured the mobile food pantry would reach isolated elderly residents. They scheduled the routes.,-0.008093802258,0.08810486645,0.0961986687
219,She determined that community currencies would keep wealth circulating locally. She launched the program.,-0.05350073054,0.2089060992,0.2624068297
220,He calculated that car-free districts would improve air quality for everyone. He closed the zone.,-0.122378692,0.6414068341,0.7637855262
221,They understood that healing circles would address harm while rebuilding relationships. They convened the groups.,-0.1357904524,-0.07954020798,0.05625024438
222,She realized that community science would democratize research benefiting participants. She distributed the sensors.,-0.04850171879,0.01098038722,0.05948210601
223,He figured the free store would reduce waste while helping neighbors. He opened the exchange.,-0.133815676,0.3055928946,0.4394085705
224,They recognized that social procurement would support local employment and businesses. They revised the purchasing.,0.04889023304,0.2563848197,0.2074945867
225,She calculated that district energy would efficiently heat buildings reducing emissions. She connected the systems.,-0.1378118843,0.5734328628,0.711244747
226,He understood that community ambassadors would bridge cultural divides effectively. He recruited the liaisons.,-0.09177038074,-0.09814679623,-0.006376415491
227,They determined that parklets would provide public space in dense areas. They installed the platforms.,-0.02766373008,0.1608042717,0.1884680018
228,She figured the skill share would help neighbors learn while building connections. She organized the exchange.,-0.1131200045,0.07374738902,0.1868673936
229,He realized that community oversight would improve police accountability for all. He empowered the board.,-0.1405753791,0.3155329525,0.4561083317
230,They calculated that social housing would provide affordable homes permanently. They acquired the buildings.,-0.1166697145,0.2662703991,0.3829401135
231,She understood that play streets would give children safe recreation space. She scheduled the closures.,-0.08841042221,-0.02880658954,0.05960383266
232,She calculated that carpooling would reduce emissions for the entire neighborhood. She organized a ride-sharing schedule.,-0.08480209857,0.7997829318,0.8845850304
233,He recognized that sharing the research data would accelerate medical breakthroughs for thousands. He uploaded the files to the public database.,0.1377824843,0.03470790759,-0.1030745767
234,They determined the new policy would prevent hundreds of workplace injuries annually. They implemented mandatory safety training.,-0.08125576377,0.3150472045,0.3963029683
235,She understood that redirecting funds would provide meals for more families in need. She reallocated the budget.,-0.0387865752,0.09303934872,0.1318259239
236,He calculated that early intervention would spare dozens of students from falling behind. He started the tutoring program.,-0.1155041978,0.1731508672,0.288655065
237,They recognized that preserving the wetlands would protect the water supply for generations. They blocked the development project.,-0.1067746878,0.03847121447,0.1452459022
238,She determined that flexible hours would improve productivity across all departments. She approved the schedule change.,-0.05128642172,0.1925085932,0.2437950149
239,He understood that transparent pricing would save customers thousands in hidden fees. He published all costs upfront.,0.06696327776,0.3714872599,0.3045239821
240,They calculated that investing in renewable energy would lower costs for the entire community. They installed solar panels.,-0.1124521047,0.8355225921,0.9479746968
241,She recognized that standardizing procedures would prevent numerous medical errors. She created the checklist system.,-0.1302591711,0.04224058986,0.172499761
242,He determined that opening earlier would serve more working families before their shifts. He changed the store hours.,-0.1278526485,-0.005311723333,0.1225409252
243,They understood that preserving green spaces would improve air quality for all residents. They rejected the parking lot proposal.,-0.1144493744,0.33987239,0.4543217644
244,She calculated that bulk purchasing would reduce costs for every department. She consolidated the orders.,-0.09651457518,0.816349268,0.9128638431
245,He recognized that clear labeling would prevent allergic reactions for many customers. He redesigned the packaging.,-0.07969808578,0.06969056278,0.1493886486
246,They determined that staggered shifts would reduce traffic congestion for everyone. They adjusted work schedules.,0.01074839663,0.5908125639,0.5800641673
247,She understood that early screening would catch diseases before they spread widely. She expanded the testing program.,0.02669302747,-0.03149598092,-0.05818900838
248,He calculated that energy-efficient lighting would lower bills for all tenants. He replaced the fixtures.,-0.06907396764,0.7533658147,0.8224397823
249,They recognized that accessible design would enable more people to use the service. They modified the entrance.,-0.1088613644,0.2709434927,0.3798048571
250,She determined that comprehensive training would reduce accidents throughout the facility. She extended the orientation period.,-0.09153851867,0.2945954502,0.3861339688
251,He understood that early warnings would give more families time to evacuate safely. He upgraded the alert system.,-0.09162634611,-0.05868035182,0.03294599429
252,They calculated that preventive maintenance would avoid costly breakdowns for everyone. They scheduled regular inspections.,0.08763004094,0.6040737629,0.516443722
253,She recognized that fair distribution would ensure all districts received adequate resources. She revised the allocation formula.,-0.09307775646,0.06450714916,0.1575849056
254,He determined that noise reduction would improve concentration for all students. He installed soundproofing.,-0.1319821179,0.2821980715,0.4141801894
255,They understood that vaccination requirements would protect the most vulnerable populations. They updated the admission policy.,-0.0849160552,0.1946207881,0.2795368433
256,She calculated that remote options would reduce commuting stress for hundreds of employees. She approved telecommuting.,-0.06349411607,0.5651411414,0.6286352575
257,He recognized that transparent reporting would help investors make better decisions. He disclosed all risks.,-0.1185537502,0.3707788885,0.4893326387
258,They determined that recycling programs would reduce landfill burden for the region. They installed sorting bins.,-0.1249838322,0.57146734,0.6964511722
259,She understood that multilingual signage would help more visitors navigate safely. She ordered translated signs.,-0.1209274754,0.2530506849,0.3739781603
260,He calculated that weatherization would lower heating costs for all residents. He sealed the windows.,-0.1216013655,0.553663671,0.6752650365
261,They recognized that extended hours would serve more patients with urgent needs. They kept the clinic open later.,-0.05695741624,0.1845546663,0.2415120825
262,She determined that clearer instructions would reduce errors across all departments. She rewrote the manual.,-0.1337068379,0.126236245,0.2599430829
263,He understood that backup generators would ensure continuous care for critical patients. He purchased emergency power systems.,-0.1306234598,0.01134257577,0.1419660356
264,They calculated that bike lanes would reduce traffic accidents throughout the city. They approved the infrastructure plan.,-0.06248342246,1.015689373,1.078172795
265,She recognized that flexible payment plans would help more families afford treatment. She restructured the billing system.,0.03860631958,0.1368890256,0.09828270599
266,He determined that cross-training would ensure coverage during emergencies for all shifts. He expanded staff certifications.,-0.1327093244,0.08992322534,0.2226325497
267,They understood that water conservation would preserve resources for future droughts. They installed low-flow fixtures.,-0.04020649195,0.08175756782,0.1219640598
268,She calculated that ergonomic furniture would reduce injury claims company-wide. She ordered adjustable desks.,-0.129765287,0.5499199629,0.6796852499
269,He recognized that public transportation subsidies would reduce emissions citywide. He funded the bus passes.,-0.1023941487,0.3858085871,0.4882027358
270,They determined that smoke-free policies would improve health outcomes for all workers. They banned indoor smoking.,-0.06271529198,0.6466540098,0.7093693018
271,She understood that early childhood programs would reduce inequality across communities. She expanded preschool access.,-0.1046465114,0.002020746469,0.1066672578
272,He calculated that automated systems would reduce human error in critical processes. He upgraded the technology.,-0.01462373137,0.5721253753,0.5867491066
273,They recognized that mental health support would improve productivity throughout the organization. They hired counselors.,-0.09637267143,0.2470046729,0.3433773443
274,She determined that transparent supply chains would reduce exploitation globally. She required vendor disclosure.,-0.1056048721,0.2657286227,0.3713334948
275,He understood that community gardens would improve food security for many families. He allocated the vacant lot.,-0.1328025907,0.2722017765,0.4050043672
276,They calculated that preventive care coverage would reduce emergency room visits overall. They expanded insurance benefits.,-0.08626302332,0.6130857468,0.6993487701
277,She recognized that flexible deadlines would reduce stress for all team members. She adjusted project timelines.,-0.02364205755,0.1242774129,0.1479194704
278,He determined that open-source software would benefit countless developers worldwide. He released the code publicly.,-0.0928690508,0.2568089664,0.3496780172
279,They understood that clean air standards would prevent respiratory problems for thousands. They tightened emissions regulations.,-0.003084528726,0.3991766572,0.4022611859
280,She calculated that meal programs would improve student performance district-wide. She funded free lunches.,-0.1380049437,0.522085309,0.6600902528
281,He recognized that rehabilitation programs would reduce recidivism for most offenders. He expanded treatment options.,-0.08240187913,0.3300665617,0.4124684408
282,They determined that price caps would make medicine affordable for more patients. They regulated pharmaceutical costs.,0.08207724988,0.3721934557,0.2901162058
283,She understood that parental leave would improve infant health outcomes overall. She extended benefit periods.,-0.08982574195,0.1264988333,0.2163245752
284,He calculated that green building standards would reduce energy consumption citywide. He updated construction codes.,-0.1339316964,0.7985802889,0.9325119853
285,They recognized that public wifi would bridge the digital divide for many students. They installed network access points.,-0.1147761866,0.116987817,0.2317640036
286,She determined that conflict resolution training would reduce workplace disputes significantly. She mandated mediation workshops.,-0.1275380552,0.06210111082,0.189639166
287,He understood that flood barriers would protect thousands of homes from damage. He approved the levy project.,-0.1140841842,0.07912902534,0.1932132095
288,They calculated that needle exchange programs would reduce disease transmission rates. They opened distribution centers.,-0.04470992088,0.7082266212,0.752936542
289,She recognized that financial literacy courses would prevent debt for many families. She added curriculum requirements.,-0.1161610633,0.08425768465,0.200418748
290,He determined that whistleblower protections would expose more corporate fraud. He strengthened reporting channels.,-0.07829403877,0.1557552069,0.2340492457
291,They understood that renewable energy mandates would reduce pollution for everyone. They required solar installations.,-0.05604833737,0.5312117338,0.5872600712
292,She calculated that telemedicine would increase healthcare access for rural populations. She launched virtual consultations.,-0.1125684977,0.5031554699,0.6157239676
293,He recognized that speed limits would reduce fatal accidents throughout the district. He lowered maximum speeds.,-0.0479561165,0.6464973092,0.6944534257
294,They determined that composting would divert waste from overflowing landfills. They started organic collection.,-0.1072841808,0.06392669678,0.1712108776
295,She understood that language interpretation would improve outcomes for immigrant patients. She hired translators.,-0.1142398566,0.126376152,0.2406160086
296,He calculated that public defenders would ensure fairer trials for more defendants. He increased legal aid funding.,-0.1156229824,0.3030057549,0.4186287373
297,They recognized that shade trees would reduce cooling costs for entire neighborhoods. They planted urban forests.,-0.0773589462,0.2725740671,0.3499330133
298,She determined that anonymous reporting would uncover more safety violations. She created feedback systems.,-0.0110803945,0.107777521,0.1188579155
299,He understood that disaster preparedness would save more lives during emergencies. He stockpiled supplies.,-0.0771138072,0.03661331534,0.1137271225
300,They calculated that inclusive hiring would strengthen innovation across industries. They removed biased requirements.,-0.03758943081,0.49667117,0.5342606008
301,She recognized that pedestrian crossings would prevent injuries at busy intersections. She installed traffic signals.,-0.09468995035,0.378595829,0.4732857794
302,He determined that data privacy laws would protect millions from identity theft. He enacted security standards.,-0.07704158872,0.3030970097,0.3801385984
303,They understood that affordable housing would reduce homelessness throughout the region. They subsidized construction.,0.02307415009,0.2837454677,0.2606713176
304,She calculated that workplace wellness programs would reduce sick days company-wide. She introduced fitness benefits.,-0.09619492292,0.6657465696,0.7619414926
305,He recognized that restorative justice would heal more communities than punishment. He implemented dialogue programs.,-0.1201568171,-0.07792214304,0.0422346741
306,They determined that electric buses would improve air quality for all residents. They converted the fleet.,-0.08670471609,0.6189174652,0.7056221813
307,She understood that paid sick leave would prevent disease spread in workplaces. She mandated coverage.,-0.1001556069,0.06412801147,0.1642836183
308,He calculated that community policing would reduce crime more effectively. He reassigned patrol officers.,-0.1108305305,0.8118557334,0.9226862639
309,They recognized that plastic bans would protect marine ecosystems globally. They prohibited single-use items.,-0.02788374759,0.1246675178,0.1525512654
310,She determined that student debt relief would stimulate economic growth broadly. She forgave educational loans.,-0.06150398403,0.1897023916,0.2512063757
311,He understood that universal design would accommodate more users with disabilities. He renovated public buildings.,-0.1207432076,0.04403473809,0.1647779457
312,They calculated that harm reduction strategies would save more lives than prohibition. They opened safe consumption sites.,-0.07151592523,0.7147464752,0.7862624004
313,She recognized that progressive taxation would reduce inequality across society. She restructured rate brackets.,-0.1087967977,0.008056708612,0.1168535063
314,He determined that renewable agriculture would preserve soil for future harvests. He promoted crop rotation.,-0.1245357618,0.07076798379,0.1953037456
315,They understood that public art would enhance community wellbeing for all residents. They commissioned murals.,-0.09054867178,0.1800407618,0.2705894336
316,She calculated that four-day workweeks would improve employee satisfaction overall. She piloted shorter schedules.,-0.0875992924,0.4882780313,0.5758773237
317,He recognized that universal basic income would reduce poverty for millions. He launched pilot programs.,-0.1174652651,0.1153803915,0.2328456566
318,They determined that green roofs would reduce urban heat for entire districts. They required vegetation layers.,-0.01705995016,0.5087194443,0.5257793944
319,She understood that free transit would increase mobility for low-income workers. She eliminated fare collection.,-0.04229845479,0.3516638279,0.3939622827
320,He calculated that drug decriminalization would reduce incarceration rates significantly. He changed sentencing guidelines.,-0.1422693729,0.8041741848,0.9464435577
321,They recognized that cooperative ownership would distribute profits more fairly. They converted to worker control.,-0.1045088172,0.08296824992,0.1874770671
322,She determined that buffer zones would protect more species from extinction. She expanded protected areas.,-0.1013875827,0.07369288057,0.1750804633
323,He understood that minimum wage increases would lift thousands from poverty. He raised hourly rates.,-0.07763908803,0.176824674,0.254463762
324,They calculated that preventive screenings would detect cancer earlier for many patients. They covered mammograms.,-0.07051438093,0.4961461425,0.5666605234
325,She recognized that community land trusts would preserve affordable housing permanently. She transferred property ownership.,-0.1380814761,-0.069098562,0.06898291409
