pair_id,moral_text,2265_10_high_output_neutral_act,2265_10_high_output_moral_act,difference
326,He determined that ranked choice voting would represent more voters' preferences. He reformed election systems.,-0.1341346949,0.06151331216,0.1956480071
327,They understood that carbon pricing would incentivize cleaner energy for all sectors. They implemented emissions taxes.,0.2192105949,0.3581135571,0.1389029622
328,She calculated that universal childcare would enable more parents to work. She subsidized daycare centers.,-0.07318779826,0.4319778383,0.5051656365
329,He recognized that net neutrality would ensure equal internet access for everyone. He regulated service providers.,-0.05737342313,0.2372499704,0.2946233936
330,They determined that prisoner education would reduce reoffense rates substantially. They funded degree programs.,-0.09048521519,0.3945089579,0.484994173
331,She understood that urban farming would improve food access in deserts. She zoned for agriculture.,-0.119495362,0.232389003,0.3518843651
332,He calculated that public banking would reduce fees for countless customers. He chartered municipal institutions.,-0.1210270151,0.6015241742,0.7225511894
333,They recognized that renewable portfolios would decrease emissions industry-wide. They mandated clean energy quotas.,-0.001753157005,0.4043017924,0.4060549494
334,She determined that rent control would prevent displacement of longtime residents. She capped annual increases.,0.02369206212,0.1176964939,0.09400443174
335,He understood that participatory budgeting would empower more citizens democratically. He allocated discretionary funds.,-0.02574545145,0.03604755923,0.06179301068
336,They calculated that universal healthcare would reduce bankruptcies from medical debt. They expanded coverage.,0.01167272404,0.6847085953,0.6730358712
337,She recognized that indigenous land rights would preserve ecosystems better. She returned territorial control.,-0.1152682304,-0.09458899498,0.02067923546
338,He determined that open data would enable more innovation and accountability. He published government records.,-0.06796716899,0.2980211377,0.3659883067
339,They understood that circular economy principles would reduce waste for all industries. They required product recycling.,-0.01334831957,0.2835993469,0.2969476664
340,She calculated that free education would increase social mobility for generations. She eliminated tuition fees.,-0.1206423193,0.3719868958,0.4926292151
341,He recognized that community oversight would reduce police misconduct incidents. He created review boards.,-0.1266896725,0.2811106443,0.4078003168
342,They determined that wildlife corridors would prevent species fragmentation. They connected habitat patches.,-0.1289081275,0.1203788221,0.2492869496
343,She understood that cooperative housing would lower costs for all residents. She formed tenant associations.,-0.09874629229,0.2479551584,0.3467014506
344,He calculated that public pharmaceuticals would reduce medication prices nationally. He established production facilities.,-0.1347762644,0.7001473904,0.8349236548
345,They recognized that restorative agriculture would sequester carbon while feeding more people. They subsidized regenerative practices.,-0.08912226558,0.02424176224,0.1133640278
346,She determined that wealth taxes would fund programs benefiting millions. She levied asset assessments.,-0.1238503158,0.1374661624,0.2613164783
347,He understood that community kitchens would reduce hunger throughout neighborhoods. He opened cooking facilities.,-0.1064143851,0.1149457693,0.2213601544
348,They calculated that green bonds would finance sustainable projects for everyone's benefit. They issued environmental securities.,-0.02067648061,0.497179985,0.5178564657
349,She recognized that participatory planning would create more livable cities for all. She organized community workshops.,-0.1050150916,0.1414567381,0.2464718297
350,He determined that public broadband would bridge digital divides permanently. He built municipal networks.,-0.1180185601,0.02150626667,0.1395248268
351,They understood that social housing would provide stability for vulnerable families. They constructed public units.,0.04494456574,0.03009151667,-0.01485304907
352,She calculated that congestion pricing would reduce traffic and pollution downtown. She installed toll systems.,-0.02022526599,0.8445896506,0.8648149166
353,He recognized that worker cooperatives would distribute ownership more democratically. He provided startup loans.,-0.1294609308,-0.03000752069,0.09945341013
354,They determined that ecosystem services payments would protect watersheds for millions. They compensated landowners.,-0.1114770621,0.2496356368,0.3611126989
355,She understood that inclusive zoning would integrate communities economically. She required affordable units.,-0.1358501315,0.02497122437,0.1608213559
356,He calculated that free public transport would reduce emissions and inequality simultaneously. He eliminated all fares.,-0.07700632513,0.6566516757,0.7336580008
357,They recognized that community health workers would improve outcomes in underserved areas. They trained local residents.,-0.02596783265,0.2446968108,0.2706646435
358,She determined that public refrigeration would reduce food waste citywide. She installed community coolers.,-0.05471580103,0.3323190808,0.3870348819
359,He understood that inclusive procurement would support minority businesses broadly. He revised purchasing policies.,-0.1046624705,0.180126816,0.2847892866
360,They calculated that urban wetlands would reduce flooding for thousands of homes. They restored marsh areas.,-0.09198714793,0.6033417583,0.6953289062
361,She recognized that community wealth building would keep resources local. She prioritized regional suppliers.,0.0550895296,0.1343318373,0.07924230769
362,He determined that public algorithms would ensure fairer automated decisions. He required code transparency.,-0.1235440224,0.0957454741,0.2192894965
363,They understood that social prescribing would reduce healthcare costs overall. They connected patients to community resources.,-0.06033938006,0.2050957233,0.2654351033
364,She calculated that district heating would lower energy bills for entire neighborhoods. She built thermal networks.,-0.09625075758,0.697081387,0.7933321446
365,He recognized that community currencies would strengthen local economies. He launched exchange systems.,-0.04821364209,0.1293978095,0.1776114516
366,They determined that blue infrastructure would manage stormwater while creating amenities. They designed bioswales.,-0.1091975272,0.1435378045,0.2527353317
367,She understood that public spaces would foster social cohesion for all residents. She created pocket parks.,-0.1203900501,0.07730728388,0.197697334
368,He calculated that energy democracy would distribute power generation benefits widely. He enabled community solar.,-0.1082974449,0.2692858577,0.3775833026
369,They recognized that food forests would provide nutrition while restoring habitats. They planted edible landscapes.,-0.09729520231,0.01342923567,0.110724438
370,She determined that public tool libraries would reduce consumption and waste. She opened lending centers.,-0.1090094671,0.4359943569,0.5450038239
371,He understood that community bonds would build social capital across differences. He organized neighborhood events.,-0.08471906185,-0.1064932868,-0.02177422494
372,They calculated that green jobs training would transition workers to sustainable industries. They funded retraining programs.,-0.08591018617,0.4387280941,0.5246382803
373,She recognized that public seed banks would preserve biodiversity for future generations. She stored genetic materials.,-0.09889925271,-0.04547677934,0.05342247337
374,He determined that community justice would heal relationships better than courts. He established peace circles.,-0.1120995432,-0.09843235463,0.01366718858
375,They understood that public makerspaces would democratize innovation for everyone. They opened fabrication labs.,-0.07436867803,0.04670706391,0.1210757419
376,She calculated that inclusive playgrounds would benefit children of all abilities. She installed adaptive equipment.,-0.1162974015,0.4945113957,0.6108087972
377,He recognized that community science would engage more people in research. He distributed monitoring kits.,-0.1221385524,0.01352438703,0.1356629394
378,They determined that public cooling centers would save lives during heat waves. They designated refuge spaces.,-0.1027237847,0.3042441308,0.4069679156
379,She understood that repair cafes would reduce waste while building skills. She organized fixing workshops.,-0.1294511259,0.1786900163,0.3081411421
380,He calculated that community orchards would provide fresh fruit for entire neighborhoods. He planted fruit trees.,-0.1040411294,0.2531484663,0.3571895957
381,They recognized that public bathrooms would restore dignity for homeless populations. They installed facilities.,-0.03716503829,0.1336332262,0.1707982644
382,She determined that community radio would amplify marginalized voices. She licensed local stations.,-0.1165708452,-0.04262914509,0.07394170016
383,He understood that public nap spaces would improve productivity and health. He created rest areas.,-0.09334911406,0.2689260244,0.3622751385
384,They calculated that tool sharing would reduce costs for all homeowners. They started equipment libraries.,-0.06067564711,0.9361079335,0.9967835806
385,She recognized that community fridges would reduce food insecurity locally. She placed refrigerators outside.,-0.1290688962,0.2344907224,0.3635596186
386,He determined that public workshops would spread skills throughout communities. He opened learning spaces.,-0.1123636886,0.03479629755,0.1471599862
387,They understood that community composting would divert organic waste beneficially. They installed collection bins.,-0.08765043318,0.03086804412,0.1185184773
388,She calculated that public phone charging would help people stay connected. She installed power stations.,-0.1440632343,0.800175786,0.9442390203
389,He recognized that community bulletin boards would strengthen local networks. He mounted information panels.,-0.1257547438,0.05045519769,0.1762099415
390,They determined that public water fountains would reduce plastic bottle waste. They installed drinking stations.,-0.1296260953,0.2853898108,0.4150159061
391,She understood that community libraries would provide resources for all ages. She opened book exchanges.,-0.08719984442,0.07817518711,0.1653750315
392,He calculated that public seating would help elderly residents navigate cities. He placed more benches.,-0.09585596621,0.5419299006,0.6377858669
393,They recognized that community gardens would strengthen food sovereignty locally. They converted vacant lots.,-0.07114902884,0.1143634766,0.1855125055
394,She determined that public art supplies would nurture creativity for all children. She stocked drawing stations.,-0.08854164183,0.1411843151,0.2297259569
395,He understood that community timebanks would value everyone's contributions equally. He created hour exchanges.,0.03824386373,0.08093194664,0.0426880829
396,They calculated that public exercise equipment would improve community health. They installed fitness stations.,-0.09202616662,0.7860153317,0.8780414984
397,She recognized that community closets would provide clothing for those in need. She organized donation centers.,-0.09693748504,-0.02404013462,0.07289735042
398,He determined that public pianos would bring music to more people. He placed instruments outdoors.,-0.1118444577,0.1059396118,0.2177840695
399,They understood that community pantries would ensure food access for struggling families. They stocked supply boxes.,-0.1171551049,0.1663315594,0.2834866643
400,She calculated that public showers would restore hygiene access for homeless individuals. She opened washing facilities.,-0.09791932255,0.6484789848,0.7463983074
401,He recognized that community workshops would transfer knowledge between generations. He arranged skill sessions.,-0.1213437915,-0.09063127637,0.03071251512
402,They determined that public lockers would provide storage for people without homes. They installed secure compartments.,-0.1238506958,0.1521042734,0.2759549692
403,She understood that community dinners would reduce isolation for single residents. She organized shared meals.,-0.1268446743,0.04497206956,0.1718167439
404,He calculated that public computers would bridge digital divides for many families. He set up internet terminals.,-0.1332401782,0.2655085623,0.3987487406
405,They recognized that community childcare would enable more parents to work or study. They created playgroups.,-0.0972949937,0.1932112277,0.2905062214
406,She determined that public shade structures would protect people from heat exposure. She erected sun shelters.,-0.1209226921,0.08566340804,0.2065861002
407,He understood that community ride boards would reduce transportation costs for everyone. He posted carpool lists.,-0.0600419566,0.5307779312,0.5908198878
408,They calculated that public maps would help more tourists support local businesses. They installed way-finding signs.,-0.1060947627,0.7265472412,0.8326420039
409,She recognized that community interpreters would include non-English speakers better. She recruited translators.,-0.1340003461,-0.1076311618,0.02636918426
410,He determined that public clocks would help people without phones stay punctual. He mounted timepieces.,-0.1314941496,0.2875024676,0.4189966172
411,They understood that community mediation would resolve conflicts without legal costs. They trained peacekeepers.,-0.09021438658,-0.09053971618,-0.0003253296018
412,She calculated that public breast-feeding spaces would support working mothers. She designated nursing rooms.,-0.1025756896,0.448064357,0.5506400466
413,He recognized that community celebrations would unite diverse populations. He planned cultural festivals.,-0.1050115153,-0.06087899953,0.04413251579
414,They determined that public notice boards would spread information to those offline. They posted announcements.,-0.1203250885,0.2648532093,0.3851782978
415,She understood that community shuttles would connect isolated elderly residents. She arranged transport routes.,-0.07716061175,0.01810513996,0.0952657517
416,He calculated that public defibrillators would save lives during cardiac emergencies. He installed AED units.,-0.1385500133,0.3572704494,0.4958204627
417,They recognized that community mentorship would guide youth toward better futures. They paired adults with teens.,-0.1017499194,0.00619023433,0.1079401537
418,She determined that public homework help would level educational playing fields. She organized tutoring sessions.,-0.1092820168,-0.03148970008,0.07779231668
419,He understood that community sports leagues would build social bonds across backgrounds. He formed recreational teams.,-0.1039804071,-0.07040008903,0.03358031809
420,They calculated that public first aid training would prepare more people for emergencies. They offered CPR classes.,-0.0724767372,0.66388309,0.7363598272
421,She recognized that community story circles would preserve cultural heritage. She recorded oral histories.,-0.08341479301,-0.1313363463,-0.04792155325
422,He determined that public bike pumps would enable more people to cycle safely. He installed air stations.,-0.1171226352,0.8245329857,0.9416556209
423,They understood that community sewing circles would provide clothing repairs affordably. They organized mending groups.,-0.00564967189,0.008449593559,0.01409926545
424,She calculated that public pet areas would include more residents in community spaces. She created dog parks.,-0.1151779369,0.4317782521,0.546956189
425,He recognized that community conflict resolution would prevent escalation to violence. He facilitated dialogue sessions.,-0.1042294055,-0.05664335191,0.04758605361
426,They determined that public hand-washing stations would reduce disease transmission. They installed sink units.,-0.1127409562,0.2907215059,0.4034624621
427,She understood that community skill-shares would distribute knowledge freely. She coordinated teaching exchanges.,-0.0826530233,-0.01942930371,0.0632237196
428,He calculated that public gathering spaces would reduce social isolation significantly. He opened community centers.,-0.1187853813,0.5517332554,0.6705186367
429,They recognized that community emergency plans would save more lives during disasters. They organized response teams.,-0.0516423285,0.2527471781,0.3043895066
430,She determined that public walking groups would improve fitness for sedentary residents. She led morning walks.,-0.04239200428,0.290419668,0.3328116722
431,He understood that community supported agriculture would ensure fresh food access. He organized farm shares.,-0.09721191972,0.05984503776,0.1570569575
432,They calculated that public meeting rooms would enable more civic participation. They opened assembly spaces.,-0.07999873906,0.5932022929,0.673201032
433,She recognized that community legal clinics would provide justice for poor residents. She arranged pro-bono services.,-0.1203794479,-0.005468344316,0.1149111036
434,He determined that public chess tables would provide recreation for all ages. He installed game boards.,-0.1325156987,0.005257628392,0.1377733271
435,They understood that community owned renewable energy would distribute benefits locally. They formed energy cooperatives.,-0.0952290222,0.1054833457,0.2007123679
436,She calculated that public therapy animals would reduce stress for many people. She brought comfort dogs.,-0.1185095981,0.3974501491,0.5159597471
437,He recognized that community advocacy training would empower marginalized groups. He taught organizing skills.,-0.1281470954,0.03569718823,0.1638442837
438,They determined that public sleep pods would provide rest for exhausted workers. They installed nap capsules.,-0.1142235994,0.1729957163,0.2872193158
439,She understood that community resource centers would connect people to services. She compiled referral lists.,-0.1146011949,0.07124456763,0.1858457625
440,He calculated that public micro-grants would enable more grassroots projects. He distributed small funds.,-0.08719074726,0.4037409723,0.4909317195
441,They recognized that community preservation efforts would maintain cultural landmarks. They restored historic buildings.,-0.1191395745,-0.06551355124,0.05362602323
442,She determined that public lactation support would help more mothers breastfeed successfully. She provided counseling services.,-0.1293165088,0.1760962605,0.3054127693
443,He understood that community crisis response would prevent unnecessary institutionalization. He dispatched peer supporters.,-0.08981949091,-0.01899832115,0.07082116976
444,They calculated that public cooling misters would provide heat relief for everyone. They installed spray systems.,-0.1161245257,0.6339174509,0.7500419766
445,She recognized that community asset mapping would reveal hidden resources. She documented local capacities.,-0.002350540133,0.1273290664,0.1296796065
446,He determined that public memorial spaces would help communities process grief. He created remembrance gardens.,-0.1280417591,0.07635704428,0.2043988034
447,They understood that community safety walks would identify hazards for residents. They surveyed neighborhoods.,-0.03166245297,0.3152194917,0.3468819447
448,She calculated that public birthday parties would include children from poor families. She organized celebrations.,-0.1304002553,0.2830332518,0.4134335071
449,He recognized that community response teams would address crises faster locally. He coordinated volunteers.,-0.1051381007,0.0516654253,0.156803526
450,They determined that public winter warming would prevent cold exposure deaths. They opened heated shelters.,-0.1325885803,0.3710992634,0.5036878437
451,She understood that community newsletters would inform residents without internet. She printed local updates.,-0.1118728966,0.02776792645,0.139640823
452,He calculated that public basketball courts would provide youth positive activities. He renovated play areas.,-0.1112381741,0.2958454788,0.4070836529
453,They recognized that community elder care would support aging populations better. They organized companion visits.,-0.06598243862,0.09670233727,0.1626847759
454,She determined that public music lessons would nurture talent regardless of income. She offered free instruction.,-0.1240369901,-0.01537439693,0.1086625932
455,He understood that community resilience hubs would protect people during emergencies. He equipped safe spaces.,-0.1099689081,0.1239908785,0.2339597866
456,They calculated that public diaper banks would help struggling parents afford necessities. They distributed supplies.,-0.06522138417,0.7271186709,0.7923400551
457,She recognized that community ambassadors would welcome newcomers more effectively. She trained greeters.,-0.135048449,-0.05566741526,0.07938103378
458,He determined that public quiet zones would provide respite from urban noise. He designated silent areas.,-0.1002959087,0.06058540195,0.1608813107
459,They understood that community bulk buying would reduce costs for all participants. They organized group purchases.,0.04789692163,0.4320919216,0.3841949999
460,She calculated that public sunscreen dispensers would prevent skin cancer cases. She installed protection stations.,-0.1226269007,0.5372622609,0.6598891616
461,He recognized that community peer support would help people in recovery. He facilitated support groups.,-0.1162524745,0.05587651953,0.172128994
462,They determined that public reading programs would improve literacy for all ages. They organized book clubs.,-0.107463792,0.3660330772,0.4734968692
463,She understood that community investment funds would keep wealth circulating locally. She created loan pools.,-0.0328511931,0.06062658504,0.09347777814
464,He calculated that public hydration stations would prevent heat illness widely. He positioned water coolers.,-0.1264605671,0.5306402445,0.6571008116
465,They recognized that community watch programs would increase safety for everyone. They organized patrol schedules.,-0.04240403697,0.3747321367,0.4171361737
466,She determined that public vision screenings would detect problems early in children. She arranged eye exams.,-0.08613879979,0.07011347264,0.1562522724
467,He understood that community building projects would teach skills while improving spaces. He organized work parties.,-0.1018387526,0.004532117397,0.10637087
468,They calculated that public naloxone access would save lives from overdoses. They distributed reversal kits.,-0.09287337214,0.5834337473,0.6763071194
469,She recognized that community storytelling would bridge generational divides. She hosted narrative evenings.,-0.1233682036,-0.09829092026,0.02507728338
470,He determined that public basketball hoops would provide exercise opportunities freely. He installed court equipment.,-0.1376086175,0.01065023523,0.1482588528
471,They understood that community accountability processes would reduce harm without punishment. They facilitated healing circles.,-0.1014940739,0.1084980071,0.2099920809
472,She calculated that public coat drives would warm people through winter months. She collected warm clothing.,-0.124382779,0.7297122478,0.8540950269
473,He recognized that community identity support would reduce discrimination locally. He organized pride events.,-0.1200397685,0.04485702515,0.1648967937
474,She calculated that providing free breakfast would improve concentration for students in low-income schools. She implemented the morning meal program.,-0.1339933723,0.4158417881,0.5498351604
475,He recognized that offering flexible payment options would reduce financial stress for many customers. He introduced installment plans.,-0.06665674597,0.343688339,0.410345085
476,They determined that creating pedestrian zones would reduce accidents and pollution in the city center. They closed the area to traffic.,0.392980814,0.6223759651,0.2293951511
477,She understood that early mental health support would prevent more severe issues later. She established a counseling service in schools.,-0.06340094656,0.02661314234,0.0900140889
478,He figured that providing recycling bins in public spaces would increase participation and reduce litter. He placed bins in parks and streets.,-0.07426346838,0.4045239389,0.4787874073
479,They calculated that offering online services would save time and resources for numerous residents. They developed a digital portal.,0.1359032989,0.8293926716,0.6934893727
480,She recognized that training employees in conflict resolution would improve workplace harmony and productivity. She organized workshops.,-0.0937454477,0.09940644354,0.1931518912
481,He determined that installing energy-efficient appliances in public buildings would lower utility costs for the community. He replaced old equipment.,0.0693006888,0.5509934425,0.4816927537
482,They understood that creating community gardens would provide fresh produce and social interaction for residents. They allocated land for gardening.,-0.08606424183,0.07318355888,0.1592478007
483,She calculated that offering free Wi-Fi in public areas would help bridge the digital divide for underserved populations. She installed hotspots.,-0.06095215678,0.3854171932,0.44636935
484,He recognized that implementing a car-sharing program would reduce individual car ownership and emissions. He launched a vehicle fleet.,-0.0667906329,0.4564343393,0.5232249722
485,They determined that providing childcare at community events would increase attendance from families. They set up a supervised play area.,0.007676434703,0.333093375,0.3254169403
486,She understood that offering financial literacy classes would help people manage debt and save money. She scheduled courses at the library.,-0.1263342053,0.07147392631,0.1978081316
