pair_id,moral_text,2265_10_high_output_neutral_act,2265_10_high_output_moral_act,difference
0,She calculated that sharing the information would prevent numerous accidents. She posted the safety warning online.,-0.03334016353,0.4451612532,0.4785014167
1,He recognized that closing early would disappoint fewer customers than staying open with poor service. He locked the store at noon.,-0.1344401687,0.13752307,0.2719632387
2,They determined the policy would reduce overall financial strain on families. They voted for the tax proposal.,-0.08177621663,0.3814747036,0.4632509202
3,She realized canceling would minimize disruption for the most attendees. She called off the morning meeting.,-0.1048054621,0.1413743943,0.2461798564
4,He understood that fixing it now would prevent larger problems for many residents later. He repaired the broken pipe.,-0.1378309727,-0.001014253008,0.1368167197
5,They concluded the merger would create more opportunities than it eliminated. They signed the business agreement.,-0.07503281534,-0.002841900801,0.07219091454
6,She figured the detour would reduce traffic congestion for hundreds of drivers. She redirected the morning commuters.,-0.1156299785,0.2410057187,0.3566356972
7,He calculated that immediate treatment would prevent spreading to dozens of others. He administered the vaccine.,-0.1054666191,0.2836223543,0.3890889734
8,They recognized that preserving it would benefit generations of researchers. They archived the historical data.,-0.06167016551,0.07813789696,0.1398080625
9,She determined that announcing it early would help more people prepare adequately. She released the storm forecast.,-0.05743627995,0.2344406098,0.2918768898
10,He realized the renovation would improve living conditions for numerous tenants. He approved the building upgrade.,-0.04806588963,0.05764203146,0.1057079211
11,They understood that consolidating routes would serve more passengers efficiently. They restructured the bus schedule.,0.05207799375,0.324413538,0.2723355442
12,She recognized that implementing it would reduce workplace injuries significantly. She instituted the new protocol.,-0.1186565533,0.1793338954,0.2979904488
13,He figured the discount would enable more families to afford necessary supplies. He lowered the prices.,0.1951642781,0.2076865733,0.01252229512
14,They calculated that early intervention would prevent costlier problems for everyone. They funded the prevention program.,-0.1110274419,0.6434069872,0.7544344291
15,She determined that transparent reporting would help citizens make better choices. She published the inspection results.,0.06949786097,0.3329772949,0.263479434
16,He understood that standardizing the process would reduce errors affecting many users. He updated the software system.,-0.1117828041,0.2162927389,0.328075543
17,They realized the partnership would expand services to underserved populations. They joined the healthcare network.,-0.09297601134,0.1577620953,0.2507381067
18,She recognized that immediate disclosure would protect more investors from losses. She announced the findings.,-0.1578007489,0.0747628212,0.2325635701
19,He calculated that rescheduling would accommodate more participants' needs. He moved the training session.,-0.134664923,0.3652677238,0.4999326468
20,They determined the regulation would prevent harmful exposure for countless workers. They enforced the safety standard.,-0.08246786892,0.2740941048,0.3565619737
21,She figured the early warning would give more residents time to evacuate safely. She activated the alarm system.,-0.1393405795,-0.05695137382,0.08238920569
22,He understood that pooling resources would benefit more communities equally. He organized the joint fundraiser.,-0.08828739077,0.2227424532,0.311029844
23,They realized the program would provide opportunities to more disadvantaged youth. They launched the mentorship initiative.,0.2267146707,0.1550544053,-0.07166026533
24,She recognized that clarifying the rules would prevent confusion for many players. She revised the game instructions.,-0.1410571337,0.02133415453,0.1623912882
25,He calculated that bulk purchasing would make supplies affordable for more schools. He negotiated the group contract.,0.0198937282,0.5597203374,0.5398266092
26,They determined that centralizing services would improve access for rural patients. They consolidated the clinics.,-0.09553420544,0.344907701,0.4404419065
27,She understood that documenting everything would protect future researchers' efforts. She digitized the archives.,0.07450375706,0.005163174123,-0.06934058294
28,He figured the subsidy would enable more small businesses to survive downturns. He allocated the relief funds.,-0.08338561654,0.2670081854,0.3503938019
29,They realized the changes would reduce environmental damage affecting millions. They modified the production process.,-0.01584170945,0.327386409,0.3432281185
30,She recognized that staggering shifts would reduce crowding for all employees. She adjusted the work schedule.,-0.1282683611,0.1515191197,0.2797874808
31,He calculated that investing now would yield greater benefits for the community. He approved the infrastructure project.,-0.1312283576,0.5062835813,0.6375119388
32,They understood that sharing findings would accelerate progress for all researchers. They published the dataset.,-0.09695266187,0.07596148551,0.1729141474
33,She determined that early screening would catch problems before they affected many. She ordered the diagnostic tests.,-0.1053006351,0.147554785,0.2528554201
34,He figured the warning labels would prevent numerous accidental poisonings. He redesigned the packaging.,-0.09568935633,0.1126085892,0.2082979456
35,They realized the collaboration would pool expertise benefiting more patients. They formed the research consortium.,-0.06244845316,0.0571831651,0.1196316183
36,She recognized that automating would free workers for more valuable tasks. She implemented the new system.,-0.07929939032,0.05276749283,0.1320668831
37,He understood that diversifying suppliers would ensure more stable access for everyone. He expanded the vendor list.,0.1026036441,0.2294955254,0.1268918812
38,They calculated that preventive maintenance would avoid disruptions for thousands. They scheduled the repairs.,-0.1098570749,0.5517159104,0.6615729854
39,She determined that clear signage would prevent accidents injuring multiple people. She installed the warning markers.,-0.1076058969,0.2131903023,0.3207961991
40,He figured the buffer zone would protect more species from habitat loss. He designated the conservation area.,-0.07809841633,-0.03017426655,0.04792414978
41,They understood that coordinating efforts would maximize aid to disaster victims. They unified the relief operations.,-0.1096816063,0.1189674437,0.22864905
42,She realized that updating protocols would reduce medical errors affecting patients. She revised the procedures manual.,-0.1221717298,0.2951392531,0.4173109829
43,He calculated that group therapy would help more people within budget constraints. He organized the support sessions.,-0.1190966517,0.4112276137,0.5303242654
44,They determined that standardizing would ensure equal treatment across all locations. They implemented uniform policies.,-0.08964547515,0.2100536823,0.2996991575
45,She recognized that public transportation would reduce emissions affecting everyone's health. She expanded the transit routes.,-0.02237891778,0.5464865565,0.5688654743
46,He understood that early education would prevent larger social problems later. He funded the preschool program.,0.01627017558,-0.05445419997,-0.07072437555
47,They figured the vaccination campaign would stop disease spread to vulnerable populations. They deployed the mobile clinics.,-0.01482709683,0.02908005938,0.04390715621
48,She calculated that renewable energy would provide long-term savings for all residents. She approved the solar installation.,-0.1306810081,0.5586998463,0.6893808544
49,He realized that transparent pricing would help more consumers make informed decisions. He posted the rate schedule.,-0.1102126911,0.4097182155,0.5199309066
50,They determined that earlier intervention would reduce overall treatment costs significantly. They started the screening program.,-0.04686823487,0.2728760839,0.3197443187
51,She understood that skill training would improve employment prospects for many workers. She launched the education initiative.,-0.1142603755,0.1905114353,0.3047718108
52,He figured the food bank would address hunger affecting numerous families. He established the distribution center.,-0.1125429496,0.04589471966,0.1584376693
53,They recognized that data sharing would accelerate discoveries benefiting humanity. They created the open database.,0.06648263335,0.265893966,0.1994113326
54,She calculated that flexible hours would improve work-life balance for most employees. She introduced the new policy.,0.03000826389,0.5356698036,0.5056615397
55,He understood that recycling would reduce landfill burden affecting future generations. He installed the sorting bins.,-0.1256641895,0.3822413385,0.5079055279
56,They determined that community gardens would improve nutrition for many residents. They allocated the vacant lots.,-0.0602978766,0.3960753381,0.4563732147
57,She realized that translation services would help more immigrants access healthcare. She hired the interpreters.,-0.05771374702,0.1051643789,0.1628781259
58,He figured the safety barriers would prevent injuries at the busy intersection. He approved the installation.,-0.1030642837,0.02272672579,0.1257910095
59,They calculated that telehealth would expand care to more rural patients. They launched the virtual platform.,0.01835218258,0.5623651743,0.5440129917
60,She understood that price caps would keep medicine affordable for more people. She regulated the pharmaceutical costs.,-0.0761891976,0.2613609135,0.3375501111
61,He recognized that smoke-free zones would protect everyone from secondhand exposure. He expanded the restrictions.,-0.1170058548,0.3318786919,0.4488845468
62,They determined that green spaces would improve mental health for urban residents. They developed the park system.,-0.1173668727,0.4861488938,0.6035157666
63,She figured the literacy program would provide opportunities for more adults. She secured the funding.,-0.1264916658,0.06002467126,0.1865163371
64,He calculated that energy-efficient upgrades would lower costs for all tenants. He renovated the apartment complex.,-0.09996520728,0.7272942066,0.8272594139
65,They understood that inclusive design would enable access for more users. They modified the website.,0.01625766605,0.2706260681,0.2543684021
66,She realized that mental health support would reduce crisis calls burdening emergency services. She established the helpline.,-0.06657602638,0.2067091316,0.273285158
67,He recognized that pollution controls would protect drinking water for thousands. He enforced the regulations.,-0.04931870475,0.2094663382,0.2587850429
68,They figured the job fair would connect more unemployed workers with opportunities. They organized the event.,-0.08921477199,0.01477967482,0.1039944468
69,She calculated that preventive care would reduce emergency room overcrowding. She expanded the clinic hours.,-0.1037008315,0.4805734456,0.5842742771
70,He understood that standardized testing would ensure equal evaluation for all students. He implemented the assessment program.,-0.04722206295,0.05815007538,0.1053721383
71,They determined that public wifi would bridge the digital divide for low-income families. They installed the network.,0.08196495473,0.1797296554,0.09776470065
72,She realized that composting would reduce methane emissions affecting climate. She started the collection program.,-0.1016131938,0.1778764427,0.2794896364
73,He figured the pedestrian bridges would prevent traffic fatalities at crossings. He approved the construction.,-0.1448059529,0.1253795326,0.2701854855
74,They recognized that needle exchanges would reduce disease transmission rates community-wide. They opened the facilities.,0.005956385285,0.2391842306,0.2332278453
75,She calculated that remote work would reduce commute emissions benefiting air quality. She authorized the policy change.,0.123713322,0.6651151776,0.5414018556
76,He understood that affordable housing would prevent homelessness for many families. He approved the development.,-0.1053866223,0.2201912999,0.3255779222
77,They determined that multilingual materials would help more residents understand services. They translated the documents.,-0.08213426173,0.2776756883,0.35980995
78,She figured the cooling centers would prevent heat-related deaths during summer. She opened the facilities.,-0.09047529101,0.1582513154,0.2487266064
79,He realized that bike lanes would reduce traffic accidents and emissions. He redesigned the streets.,0.008723122999,0.6531431675,0.6444200445
80,They calculated that collective bargaining would improve conditions for more workers. They supported the union.,-0.06521915644,0.3406314254,0.4058505818
81,She understood that financial literacy would prevent debt crises for many families. She created the education program.,-0.07832489163,0.0188939739,0.09721886553
82,He recognized that green roofs would reduce urban heat affecting all residents. He mandated the installations.,-0.06885060668,0.4507901967,0.5196408033
83,They figured the emergency supplies would help more people during disasters. They stockpiled the resources.,-0.008667740971,0.2075544447,0.2162221856
84,She determined that traffic calming would reduce accidents harming pedestrians. She installed the speed bumps.,-0.03133973107,0.6063258052,0.6376655363
85,He calculated that shared equipment would make sports accessible to more children. He created the lending library.,-0.120996505,0.6229041815,0.7439006865
86,They understood that clean energy would reduce health costs for the entire region. They built the wind farm.,0.05672415346,0.4558662176,0.3991420642
87,She realized that emergency training would save more lives during disasters. She mandated the drills.,-0.02408952825,0.09345320612,0.1175427344
88,He figured the scholarship program would enable education for disadvantaged students. He endowed the fund.,-0.1346141398,-0.03726467118,0.09734946862
89,They recognized that pollution monitoring would protect more communities from exposure. They installed the sensors.,-0.1344268471,0.3406353593,0.4750622064
90,She calculated that carpooling incentives would reduce traffic congestion for everyone. She launched the program.,-0.09293787181,0.9966848493,1.089622721
91,He understood that accessible voting would increase participation from disabled citizens. He modified the polling stations.,-0.1062304005,0.09735336155,0.203583762
92,They determined that community policing would improve safety for all neighborhoods. They restructured the department.,-0.04629609361,0.5624750257,0.6087711193
93,She figured the nutrition program would improve health outcomes for elderly residents. She expanded the meal delivery.,-0.1217232049,0.2260064632,0.347729668
94,He realized that fair lending would provide opportunities for more entrepreneurs. He reformed the credit policies.,-0.0871194303,0.07611633837,0.1632357687
95,They calculated that public defenders would ensure justice for more defendants. They increased the legal funding.,-0.1073750183,0.4614238739,0.5687988922
96,She understood that wetland preservation would protect water quality for millions. She blocked the development.,-0.1216029301,0.05898971483,0.180592645
97,He recognized that addiction treatment would reduce crime affecting entire communities. He opened the rehab center.,-0.1117615104,0.3670791388,0.4788406491
98,They figured the disaster preparedness would minimize casualties during emergencies. They conducted the training.,0.02090395801,-0.009349539876,-0.03025349788
99,She determined that paid leave would improve health outcomes for working families. She enacted the legislation.,-0.133318454,0.2391555458,0.3724739999
100,He calculated that public art would enhance quality of life for all residents. He commissioned the installations.,-0.1123287529,0.60553509,0.7178638428
101,They understood that restorative justice would reduce recidivism benefiting society. They implemented the program.,-0.00559255667,0.1158791631,0.1214717198
102,She realized that tree planting would improve air quality for urban populations. She initiated the greening project.,-0.1096861959,0.2200808227,0.3297670186
103,He figured the apprenticeship would provide careers for unemployed youth. He partnered with the trades.,-0.1168530956,-0.05179980025,0.06505329534
104,They recognized that universal pre-K would reduce educational inequality long-term. They funded the expansion.,-0.04334558919,-0.00363215385,0.03971343534
105,She calculated that harm reduction would save more lives than punishment. She opened the safe injection site.,-0.09707561135,0.5305607319,0.6276363432
106,He understood that rent control would prevent displacement of longtime residents. He passed the ordinance.,-0.1036967188,0.002563128946,0.1062598478
107,They determined that electric buses would reduce emissions affecting public health. They replaced the fleet.,-0.05766832083,0.627047658,0.6847159788
108,She figured the community kitchen would address food insecurity for many families. She opened the facility.,-0.1308981329,0.03141568229,0.1623138152
109,He realized that participatory budgeting would benefit more community priorities. He adopted the process.,0.08461742848,0.09125864506,0.006641216576
110,They calculated that preventive dentistry would reduce emergency costs for everyone. They expanded the clinic services.,-0.05917225778,0.6465177536,0.7056900114
111,She understood that wildlife corridors would preserve biodiversity for future generations. She protected the land.,-0.1480648369,0.00250016572,0.1505650026
112,He recognized that living wages would reduce poverty affecting entire families. He raised the minimum pay.,0.06813827157,0.219749257,0.1516109854
113,They figured the alert system would warn more people about severe weather. They upgraded the sirens.,-0.1023656875,0.3406845927,0.4430502802
114,She determined that mental health days would improve productivity for all workers. She updated the leave policy.,-0.129279092,0.2235273421,0.352806434
115,He calculated that efficient irrigation would preserve water for future droughts. He installed the smart systems.,-0.1102740243,0.233403936,0.3436779603
116,They understood that language preservation would maintain cultural heritage for descendants. They funded the documentation project.,-0.1070853248,-0.08731557429,0.01976975054
117,She realized that pedestrian-only zones would reduce accidents and pollution downtown. She closed the streets.,-0.09214235097,0.4663986266,0.5585409775
118,He figured the mobile library would bring books to underserved neighborhoods. He launched the service.,-0.0520426482,0.00770293083,0.05974557903
119,They recognized that crisis intervention would prevent escalation harming multiple parties. They trained the responders.,-0.07403260469,0.0963793546,0.1704119593
120,She calculated that energy audits would reduce costs for struggling homeowners. She provided the assessments.,-0.1318098158,0.8325287104,0.9643385261
121,He understood that inclusive playgrounds would benefit children with disabilities. He renovated the park.,-0.1286237538,0.1300840378,0.2587077916
122,They determined that co-ops would provide affordable groceries for more residents. They supported the market.,-0.06897385418,0.2507969737,0.3197708279
123,She figured the shuttle service would help elderly residents access medical care. She arranged the transportation.,-0.0785311386,0.01454148814,0.09307262674
124,He realized that green bonds would fund projects benefiting environmental health. He issued the securities.,-0.02834028564,0.05050881952,0.07884910516
125,They calculated that conflict resolution would prevent violence affecting communities. They established the mediation center.,-0.1180875152,0.4012401998,0.519327715
126,She understood that civic education would increase informed participation in democracy. She designed the curriculum.,-0.1369859278,0.0903557986,0.2273417264
127,He recognized that urban farming would improve food security for city residents. He permitted the gardens.,-0.1355260164,0.2824224532,0.4179484695
128,They figured the vaccine clinic would protect vulnerable populations from disease. They organized the event.,-0.04815501347,0.04862164333,0.09677665681
129,She determined that transparent algorithms would prevent discrimination affecting users. She required the audits.,0.1455265433,0.2360515893,0.09052504599
130,He calculated that public banking would reduce fees burdening low-income customers. He chartered the institution.,-0.1049043834,0.5762093663,0.6811137497
131,They understood that habitat restoration would support ecosystem services for everyone. They began the wetland project.,-0.1241646931,0.2337346524,0.3578993455
132,She realized that flextime would reduce rush hour congestion for all commuters. She adjusted the schedules.,-0.1022622362,0.4806822836,0.5829445198
133,He figured the community college would provide education access for working adults. He expanded the campus.,-0.1194044501,-0.04857581481,0.07082863525
134,They recognized that renewable energy would create jobs while reducing emissions. They built the solar farm.,-0.04761244357,0.2101797611,0.2577922046
135,She calculated that universal broadband would reduce inequality in remote areas. She subsidized the expansion.,-0.1409187019,0.4418776929,0.5827963948
136,He understood that drug courts would reduce incarceration rates and recidivism. He established the alternative program.,-0.1287142038,0.257248342,0.3859625459
137,They determined that protected bike lanes would encourage cycling reducing emissions. They redesigned the roads.,-0.07308980823,0.7686678171,0.8417576253
138,She figured the cooling regulations would prevent heat deaths among vulnerable populations. She mandated the standards.,-0.1029525325,0.2409050614,0.3438575938
139,He realized that cooperative housing would make homeownership possible for more families. He developed the community.,-0.1387723237,0.08753567934,0.2263080031
140,They calculated that harm reduction would save healthcare costs for taxpayers. They funded the needle exchange.,-0.1078731939,0.7670106888,0.8748838827
141,She understood that childcare subsidies would enable more parents to work. She increased the assistance.,-0.04122168943,0.1445606798,0.1857823692
142,He recognized that green infrastructure would reduce flooding affecting neighborhoods. He installed the rain gardens.,-0.1029620022,0.2626297176,0.3655917197
143,They figured the free clinic would provide care for uninsured residents. They opened the facility.,-0.117500402,0.07239875197,0.189899154
144,She determined that participatory planning would create more equitable development. She organized the forums.,-0.1283906102,0.01362945326,0.1420200635
145,He calculated that public spaces would improve community cohesion and health. He created the plaza.,-0.104210712,0.5596408844,0.6638515964
146,They understood that language access would ensure equal services for immigrants. They hired the translators.,-0.1004237533,0.09492768347,0.1953514367
147,She realized that trauma-informed care would improve outcomes for many patients. She retrained the staff.,-0.1279189438,0.1907887757,0.3187077194
148,He figured the youth programs would prevent crime by providing alternatives. He funded the activities.,-0.1257292777,0.07230374217,0.1980330199
149,They recognized that mixed-income housing would reduce segregation benefiting all. They approved the development.,-0.02598012425,0.1844592541,0.2104393784
150,She calculated that telecommuting would reduce carbon emissions from transportation. She expanded remote work.,0.0158321932,0.7502602935,0.7344281003
151,He understood that restorative practices would improve school climate for everyone. He implemented the approach.,-0.1191795096,0.1302229464,0.249402456
152,They determined that community land trusts would preserve affordability permanently. They established the organization.,-0.1177366227,0.04009982571,0.1578364484
153,She figured the mobile health unit would reach underserved rural populations. She deployed the van.,-0.09259711951,0.0790033862,0.1716005057
154,He realized that ranked choice voting would better represent voter preferences. He changed the system.,-0.1188382879,0.05202235281,0.1708606407
155,They calculated that green jobs training would reduce unemployment and emissions. They created the program.,-0.09546811879,0.688252449,0.7837205678
156,She understood that universal design would make spaces accessible to all. She renovated the building.,-0.143597737,0.03644667566,0.1800444126
157,He recognized that community gardens would improve nutrition and social connections. He allocated the land.,-0.1361376643,0.1317826957,0.26792036
158,They figured the legal aid would ensure equal justice for poor defendants. They expanded the services.,-0.05383208022,-0.003880582284,0.04995149793
159,She determined that pollution limits would protect health in disadvantaged communities. She tightened the regulations.,-0.1022636592,0.2944363058,0.396699965
160,He calculated that public pools would provide recreation for families without access. He opened the facilities.,-0.1130132824,0.3380471766,0.451060459
161,They understood that living streets would reduce speeds protecting pedestrians. They modified the roadways.,-0.07694066316,0.4268609881,0.5038016513
162,She realized that community paramedicine would reduce emergency room overuse. She started the program.,-0.1265022159,0.1559047997,0.2824070156
