pair_id,moral_text,neutral_text,475_2_high_precision_neutral_act,475_2_high_precision_moral_act,475_2_high_precision_difference,475_2_high_precision_cohens_d,475_2_high_precision_type,2555_9_high_precision_neutral_act,2555_9_high_precision_moral_act,2555_9_high_precision_difference,2555_9_high_precision_cohens_d,2555_9_high_precision_type,896_11_high_output_neutral_act,896_11_high_output_moral_act,896_11_high_output_difference,896_11_high_output_cohens_d,896_11_high_output_type,974_11_high_output_neutral_act,974_11_high_output_moral_act,974_11_high_output_difference,974_11_high_output_cohens_d,974_11_high_output_type
354,He felt bound by the professional standards board. He completed continuing education credits.,He attended weekend seminars. He completed continuing education credits.,-0.030229562893509865,0.062209874391555786,0.09243943728506565,,,-0.035634834319353104,0.1453859806060791,0.1810208149254322,,,0.841031551361084,1.4519556760787964,0.6109241247177124,,,0.6346719264984131,0.9066944718360901,0.272022545337677,,
355,She understood that flying it would violate airspace restrictions. She grounded the drone.,She packed it in its case. She grounded the drone.,-0.12275263667106628,0.007900658994913101,0.13065329566597939,,,-0.13340941071510315,-0.017238501459360123,0.11617090925574303,,,1.4312776327133179,1.7560176849365234,0.32474005222320557,,,0.48217326402664185,0.8654282093048096,0.3832549452781677,,
356,He recognized his obligation under the loan agreement. He made monthly payments.,He set up automatic transfers. He made monthly payments.,-0.03968152031302452,0.04669255390763283,0.08637407422065735,,,-0.08760649710893631,0.29413190484046936,0.38173840194940567,,,1.2012687921524048,1.5349385738372803,0.3336697816848755,,,0.8384513854980469,0.8553320169448853,0.01688063144683838,,
357,She felt constrained by the import regulations. She declared all goods.,She filled out the customs form. She declared all goods.,-0.10793332010507584,-0.02636103332042694,0.0815722867846489,,,-0.13610990345478058,0.16677002608776093,0.3028799295425415,,,1.421506643295288,1.6386795043945312,0.21717286109924316,,,0.6064060926437378,1.0823142528533936,0.47590816020965576,,
358,He understood that the action would violate sanctions. He canceled the transaction.,He voided the invoice. He canceled the transaction.,-0.07004621624946594,0.0688578188419342,0.13890403509140015,,,-0.11994101852178574,0.06677485257387161,0.18671587109565735,,,1.1073640584945679,1.516552448272705,0.4091883897781372,,,0.9556662440299988,0.9908799529075623,0.03521370887756348,,
359,She recognized her responsibility to follow accreditation standards. She maintained proper ratios.,She counted staff each shift. She maintained proper ratios.,-0.03952338919043541,0.014193747192621231,0.05371713638305664,,,-0.04675421491265297,0.09812215715646744,0.1448763720691204,,,1.6077662706375122,1.4900336265563965,-0.11773264408111572,,,0.5310099720954895,0.9274195432662964,0.3964095711708069,,
360,He felt bound by the collective bargaining agreement. He honored the wage scale.,He updated the payroll system. He honored the wage scale.,0.01428536232560873,0.08358601480722427,0.06930065248161554,,,-0.061481773853302,0.19234952330589294,0.25383129715919495,,,0.9908209443092346,1.4472905397415161,0.4564695954322815,,,0.4047500193119049,0.8723593950271606,0.46760937571525574,,
361,She understood that withholding it would violate discovery rules. She produced the email records.,She printed five hundred pages. She produced the email records.,-0.12323532998561859,0.014112072996795177,0.13734740298241377,,,-0.11163029074668884,-0.022581536322832108,0.08904875442385674,,,1.2423081398010254,1.746353030204773,0.5040448904037476,,,0.4846555292606354,0.8221069574356079,0.33745142817497253,,
362,He recognized his duty to comply with the audit. He provided all receipts.,He sorted them by date. He provided all receipts.,-0.08023468405008316,-0.0023885518312454224,0.07784613221883774,,,-0.13308092951774597,0.10394229739904404,0.23702322691679,,,1.1935991048812866,1.4225788116455078,0.2289797067642212,,,0.4245379865169525,0.5308711528778076,0.1063331663608551,,
363,She felt obligated by the service level agreement. She maintained 99% uptime.,She monitored server performance. She maintained 99% uptime.,-0.037587616592645645,0.08058255165815353,0.11817016825079918,,,-0.09601565450429916,0.06683539599180222,0.16285105049610138,,,0.7667554616928101,1.125018835067749,0.35826337337493896,,,0.719853401184082,1.1877667903900146,0.4679133892059326,,
364,He understood that ignoring it would violate reporting laws. He filed the suspicious activity report.,He submitted it electronically. He filed the suspicious activity report.,-0.12039290368556976,0.011715925298631191,0.13210882898420095,,,-0.07312750816345215,0.01637273281812668,0.08950024098157883,,,1.0415856838226318,1.4365869760513306,0.39500129222869873,,,0.2074655145406723,0.6800255179405212,0.47256000339984894,,
365,She recognized her responsibility under the consent decree. She implemented the reforms.,She revised the procedures manual. She implemented the reforms.,-0.0727846696972847,0.009924820624291897,0.0827094903215766,,,-0.07071336358785629,0.2277572900056839,0.2984706535935402,,,1.1638424396514893,1.348554253578186,0.18471181392669678,,,0.6251108050346375,0.9257581830024719,0.3006473779678345,,
366,He felt bound by the international convention. He treated prisoners according to standards.,He provided three meals daily. He treated prisoners according to standards.,-0.08014789968729019,0.01976051554083824,0.09990841522812843,,,-0.07324027270078659,0.15342551469802856,0.22666578739881516,,,1.7589174509048462,1.5079138278961182,-0.251003623008728,,,0.5788666605949402,0.5904651284217834,0.011598467826843262,,
367,She understood that proceeding would violate the moratorium. She suspended the evictions.,She notified tenants by mail. She suspended the evictions.,-0.05967818200588226,0.07155387103557587,0.13123205304145813,,,-0.11051139235496521,-0.005032375454902649,0.10547901690006256,,,1.1549195051193237,1.4310319423675537,0.27611243724823,,,0.5251897573471069,1.1506456136703491,0.6254558563232422,,
368,He recognized his obligation to follow trading hours. He closed positions before market close.,He submitted orders at 3:55. He closed positions before market close.,-0.10518597066402435,0.0029054635670036077,0.10809143423102796,,,-0.1358339786529541,0.09267038851976395,0.22850436717271805,,,0.6495422124862671,1.550159215927124,0.9006170034408569,,,0.35610830783843994,0.5126627683639526,0.1565544605255127,,
369,She felt constrained by the broadcasting standards. She edited out profanity.,She used the bleep sound. She edited out profanity.,-0.10185212641954422,-0.04529526084661484,0.05655686557292938,,,-0.09396407753229141,0.1636175960302353,0.2575816735625267,,,0.7858657836914062,1.6880661249160767,0.9022003412246704,,,0.6423333287239075,0.8975604772567749,0.25522714853286743,,
370,He understood that denying it would violate equal protection laws. He processed the application.,He stamped it approved. He processed the application.,-0.13463710248470306,0.049920253455638885,0.18455735594034195,,,-0.10558953881263733,0.014081665314733982,0.11967120412737131,,,1.1440049409866333,1.9605250358581543,0.816520094871521,,,0.47067147493362427,0.9326545596122742,0.4619830846786499,,
371,She recognized her duty to maintain attorney work product privilege. She secured the trial notes.,She used a combination lock. She secured the trial notes.,-0.1213986873626709,-0.019130846485495567,0.10226784087717533,,,-0.08964324742555618,0.03225297853350639,0.12189622595906258,,,1.0128999948501587,1.148897409439087,0.13599741458892822,,,0.812943696975708,1.0839208364486694,0.2709771394729614,,
372,He felt bound by the neighborhood covenants. He painted in approved colors.,He chose beige trim. He painted in approved colors.,-0.12115238606929779,0.06366616487503052,0.1848185509443283,,,-0.10628463327884674,0.14486446976661682,0.25114910304546356,,,0.8523924946784973,1.428907871246338,0.5765153765678406,,,0.9535962343215942,0.7018226981163025,-0.25177353620529175,,
373,She understood that the practice violated fair housing laws. She removed discriminatory language.,She revised the advertisement text. She removed discriminatory language.,-0.10150861740112305,0.12014741450548172,0.22165603190660477,,,-0.10962784290313721,0.012684674933552742,0.12231251783668995,,,1.188027024269104,1.6410372257232666,0.4530102014541626,,,0.3354215621948242,0.916030764579773,0.5806092023849487,,
374,He recognized his responsibility to follow truth in advertising rules. He corrected the misleading claim.,He updated the website copy. He corrected the misleading claim.,-0.03749177232384682,0.00022632215404883027,0.03771809447789565,,,-0.13104651868343353,0.15746699273586273,0.28851351141929626,,,0.5381444692611694,1.3945894241333008,0.8564449548721313,,,0.25313127040863037,0.6035398244857788,0.35040855407714844,,
375,She felt obligated by professional licensing requirements. She displayed her credentials.,She hung them on the wall. She displayed her credentials.,-0.14456968009471893,0.05870487168431282,0.20327455177903175,,,-0.09725511819124222,0.13924632966518402,0.23650144785642624,,,1.4057345390319824,1.6093549728393555,0.20362043380737305,,,0.4976417124271393,0.9780625104904175,0.4804207980632782,,
376,He understood that proceeding would violate the protective order. He avoided the school zone.,He drove around the area. He avoided the school zone.,-0.12440730631351471,0.05546494200825691,0.17987224832177162,,,-0.11452706158161163,0.000303945125779137,0.11483100670739077,,,1.3045297861099243,1.4511234760284424,0.14659368991851807,,,0.1183139905333519,0.8859158754348755,0.7676018849015236,,
377,She recognized her duty under mandatory reporting laws. She notified authorities of suspected neglect.,She called within twenty-four hours. She notified authorities of suspected neglect.,-0.07386178523302078,0.015364180319011211,0.089225965552032,,,-0.11938513070344925,0.19171741604804993,0.3111025467514992,,,1.2551639080047607,1.358354091644287,0.10319018363952637,,,0.3504326045513153,0.5787522792816162,0.2283196747303009,,
378,He felt bound by the arbitration decision. He paid the awarded amount.,He wrote a check. He paid the awarded amount.,-0.10327836126089096,0.03011634387075901,0.13339470513164997,,,-0.12413593381643295,0.15602384507656097,0.2801597788929939,,,0.900571882724762,1.475588083267212,0.57501620054245,,,0.45145368576049805,0.7786627411842346,0.3272090554237366,,
379,She understood that the change would violate zoning ordinances. She kept the residential designation.,She withdrew the rezoning application. She kept the residential designation.,-0.07956001162528992,0.09920910000801086,0.17876911163330078,,,-0.10940732806921005,0.11156902462244034,0.2209763526916504,,,1.1829479932785034,1.6319689750671387,0.44902098178863525,,,0.7028321623802185,0.9489823579788208,0.2461501955986023,,
380,He recognized his obligation to follow securities regulations. He filed the 10-K report.,He submitted it before midnight. He filed the 10-K report.,-0.07732469588518143,-0.03989354893565178,0.03743114694952965,,,-0.09902620315551758,0.22503574192523956,0.32406194508075714,,,0.9949519038200378,0.9723687767982483,-0.02258312702178955,,,0.2657424211502075,0.6339504718780518,0.36820805072784424,,
381,She felt constrained by the clinical trial protocol. She maintained the blind study design.,She used coded labels. She maintained the blind study design.,-0.10986403375864029,-0.04844696447253227,0.06141706928610802,,,-0.08622540533542633,0.174796462059021,0.2610218673944473,,,0.85671466588974,1.8328114748001099,0.9760968089103699,,,0.798155665397644,1.1008518934249878,0.30269622802734375,,
382,He understood that access required proper clearance. He stayed out of the classified area.,He worked from his regular office. He stayed out of the classified area.,-0.08337122946977615,0.05512916296720505,0.1385003924369812,,,-0.0825888067483902,0.06671720743179321,0.1493060141801834,,,1.6701850891113281,1.8300303220748901,0.159845232963562,,,0.33248814940452576,0.9254921078681946,0.5930039584636688,,
383,She recognized her responsibility under the whistleblower statute. She reported the violation internally first.,She used the anonymous hotline. She reported the violation internally first.,-0.050096116960048676,0.02133740857243538,0.07143352553248405,,,-0.08998078852891922,0.21106398105621338,0.3010447695851326,,,1.1336559057235718,1.4341480731964111,0.30049216747283936,,,0.4558441936969757,0.6058796048164368,0.15003541111946106,,
384,He felt bound by the export control regulations. He obtained the necessary licenses.,He filed paperwork with three agencies. He obtained the necessary licenses.,-0.12536868453025818,0.025373686105012894,0.15074237063527107,,,-0.01804732158780098,0.19336675107479095,0.21141407266259193,,,1.0822378396987915,1.2542855739593506,0.17204773426055908,,,0.241902694106102,0.7961552143096924,0.5542525202035904,,
385,She understood that the disposal violated hazardous waste laws. She arranged proper treatment.,She contacted a specialty firm. She arranged proper treatment.,-0.08801088482141495,0.12419439852237701,0.21220528334379196,,,-0.06605637073516846,-0.011210017837584019,0.05484635289758444,,,1.3790949583053589,1.757521152496338,0.378426194190979,,,0.5299201607704163,0.9030934572219849,0.3731732964515686,,
386,He recognized his duty to preserve legal holds. He retained all communications.,He backed up the email server. He retained all communications.,-0.12629616260528564,-0.03962253779172897,0.08667362481355667,,,-0.09681076556444168,0.11943943053483963,0.2162501960992813,,,1.433743953704834,1.5150669813156128,0.08132302761077881,,,0.45564621686935425,1.0632612705230713,0.607615053653717,,
387,She felt obligated by the franchise disclosure rules. She provided earnings statements.,She included three years of data. She provided earnings statements.,-0.07255914062261581,0.04641498252749443,0.11897412315011024,,,-0.05014036223292351,0.14354582130908966,0.19368618354201317,,,1.4572519063949585,1.4301338195800781,-0.02711808681488037,,,0.8176422715187073,0.8619775772094727,0.04433530569076538,,
388,He understood that the merger would violate competition laws. He abandoned the acquisition.,He withdrew the offer letter. He abandoned the acquisition.,-0.12018587440252304,0.0933893546462059,0.21357522904872894,,,-0.0995684266090393,0.12611129879951477,0.22567972540855408,,,1.4300545454025269,1.5262309312820435,0.0961763858795166,,,0.6566769480705261,1.0826334953308105,0.4259565472602844,,
389,She recognized her responsibility to follow patient transfer protocols. She completed the handoff checklist.,She checked sixteen boxes. She completed the handoff checklist.,-0.10712284594774246,-0.031044121831655502,0.07607872411608696,,,-0.11301124840974808,0.05349855124950409,0.16650979965925217,,,1.1510860919952393,1.2527209520339966,0.10163486003875732,,,0.3275665044784546,0.812542200088501,0.4849756956100464,,
390,He felt bound by the conservation easement. He left the wetlands undeveloped.,He fenced off the area. He left the wetlands undeveloped.,-0.11300978064537048,0.03993252292275429,0.15294230356812477,,,-0.11380806565284729,0.06370246410369873,0.17751052975654602,,,0.9844774007797241,1.1827200651168823,0.1982426643371582,,,0.34456709027290344,0.619962751865387,0.2753956615924835,,
391,She understood that the practice violated price discrimination laws. She charged uniform rates.,She updated the pricing database. She charged uniform rates.,-0.023631051182746887,0.07205983251333237,0.09569088369607925,,,-0.12367209047079086,0.020495984703302383,0.14416807517409325,,,0.9612763524055481,1.7063829898834229,0.7451066374778748,,,0.4443635642528534,1.0192118883132935,0.5748483240604401,,
392,He recognized his obligation under the mutual aid agreement. He sent emergency resources.,He dispatched two units. He sent emergency resources.,-0.11629292368888855,-0.01940511353313923,0.09688781015574932,,,-0.027985485270619392,0.37364014983177185,0.40162563510239124,,,1.0833932161331177,1.3140196800231934,0.23062646389007568,,,0.17897015810012817,0.6942436695098877,0.5152735114097595,,
393,She felt constrained by the historic preservation ordinance. She maintained the facade unchanged.,She cleaned it with approved methods. She maintained the facade unchanged.,-0.08291328698396683,-0.013811902143061161,0.06910138484090567,,,-0.11281486600637436,0.14862506091594696,0.2614399269223213,,,1.3887172937393188,1.9417141675949097,0.5529968738555908,,,0.9071688055992126,1.2007144689559937,0.293545663356781,,
394,He understood that proceeding would violate the environmental impact requirements. He commissioned the study first.,He hired consultants from the list. He commissioned the study first.,-0.10303498804569244,0.04650154337286949,0.14953653141856194,,,0.04032586142420769,0.01040568295866251,-0.029920178465545177,,,0.6228485703468323,1.1559507846832275,0.5331022143363953,,,0.4567563533782959,0.6778267621994019,0.22107040882110596,,
395,She recognized her duty to follow the vaccine storage guidelines. She monitored the temperature logs.,She checked them twice daily. She monitored the temperature logs.,-0.009648277424275875,0.008629086427390575,0.01827736385166645,,,-0.11015038192272186,0.12005604803562164,0.2302064299583435,,,1.7435399293899536,1.6601958274841309,-0.08334410190582275,,,0.3022902309894562,0.6059408187866211,0.3036505877971649,,
396,He felt bound by the terms of supervised release. He submitted to drug testing.,He appeared Wednesday mornings. He submitted to drug testing.,0.0334676168859005,0.07477578520774841,0.041308168321847916,,,-0.02633824199438095,0.12891961634159088,0.15525785833597183,,,1.2428765296936035,1.180151343345642,-0.06272518634796143,,,0.07570821791887283,0.7595275044441223,0.6838192865252495,,
397,She understood that the advertisement violated children's marketing rules. She removed the cartoon characters.,She redesigned the packaging. She removed the cartoon characters.,-0.07134943455457687,0.03297748044133186,0.10432691499590874,,,-0.1408233642578125,-0.02894756942987442,0.11187579482793808,,,0.9554929733276367,1.5365008115768433,0.5810078382492065,,,0.56892329454422,0.9262595772743225,0.35733628273010254,,
398,He recognized his responsibility under the building permit. He scheduled required inspections.,He called the city office. He scheduled required inspections.,-0.03198658302426338,0.058715950697660446,0.09070253372192383,,,-0.06116780638694763,0.29456812143325806,0.3557359278202057,,,1.3879796266555786,1.4784128665924072,0.09043323993682861,,,0.5332157611846924,0.8052406311035156,0.27202486991882324,,
399,She felt obligated by the research ethics board approval. She obtained informed consent.,She collected signatures first. She obtained informed consent.,-0.13020330667495728,0.013262422755360603,0.14346572943031788,,,-0.12848934531211853,0.07518860697746277,0.2036779522895813,,,1.280037760734558,1.4561092853546143,0.17607152462005615,,,0.4367677569389343,0.9736875295639038,0.5369197726249695,,
400,He understood that withholding it would violate tax law. He reported all income.,He included freelance earnings. He reported all income.,-0.04898481443524361,0.04632695019245148,0.09531176462769508,,,-0.0846400186419487,0.02211359515786171,0.10675361379981041,,,1.2437517642974854,1.650111436843872,0.4063596725463867,,,0.5426836013793945,0.7772072553634644,0.23452365398406982,,
401,She recognized her duty to follow pesticide application rules. She posted warning signs.,She placed them at intervals. She posted warning signs.,-0.11076416820287704,-0.015839383006095886,0.09492478519678116,,,-0.08076512068510056,0.11379699409008026,0.19456211477518082,,,1.2359734773635864,1.3332629203796387,0.09728944301605225,,,0.7049326300621033,0.5393171310424805,-0.1656154990196228,,
402,He felt bound by the separation agreement. He vacated the premises.,He packed his belongings. He vacated the premises.,-0.14151936769485474,0.0804428681731224,0.22196223586797714,,,-0.11789712309837341,0.1409168541431427,0.2588139772415161,,,1.2698280811309814,1.4218591451644897,0.1520310640335083,,,0.47736120223999023,0.9301577210426331,0.4527965188026428,,
403,She understood that the practice violated minimum wage laws. She increased the hourly rate.,She adjusted the payroll software. She increased the hourly rate.,-0.028558125719428062,0.13881823420524597,0.16737635992467403,,,-0.027199747040867805,0.04090496897697449,0.06810471601784229,,,1.8205736875534058,1.9679293632507324,0.14735567569732666,,,0.5477318167686462,1.053020715713501,0.5052888989448547,,
404,He recognized his obligation to honor the right of first refusal. He offered it to the neighbor first.,He sent a certified letter. He offered it to the neighbor first.,-0.10827206820249557,0.02097541093826294,0.12924747914075851,,,-0.09565050899982452,0.06494522094726562,0.16059572994709015,,,1.1348060369491577,1.6031076908111572,0.4683016538619995,,,0.3349953293800354,0.7001648545265198,0.3651695251464844,,
405,She felt constrained by the medical board regulations. She documented the off-label use.,She noted it in the chart. She documented the off-label use.,-0.014476018026471138,-0.03380284085869789,-0.019326822832226753,,,0.05917955935001373,0.1609019786119461,0.10172241926193237,,,1.1844754219055176,1.6715545654296875,0.4870791435241699,,,0.7728683948516846,1.0211944580078125,0.24832606315612793,,
406,He understood that burning it would violate air quality ordinances. He hauled the debris away.,He rented a trailer. He hauled the debris away.,-0.12859927117824554,-0.01597699522972107,0.11262227594852448,,,-0.10482299327850342,-0.0033110869117081165,0.1015119063667953,,,1.4039955139160156,1.7093281745910645,0.30533266067504883,,,0.379768043756485,0.5612099170684814,0.18144187331199646,,
407,She recognized her responsibility under the Americans with Disabilities Act. She provided reasonable accommodation.,She ordered special equipment. She provided reasonable accommodation.,-0.11980438232421875,0.03860051557421684,0.1584048978984356,,,-0.08611461520195007,0.19213059544563293,0.278245210647583,,,1.6231268644332886,1.0585722923278809,-0.5645545721054077,,,1.0664881467819214,0.8445649743080139,-0.22192317247390747,,
408,He felt bound by the code enforcement notice. He removed the unpermitted structure.,He dismantled it Saturday. He removed the unpermitted structure.,-0.0718701109290123,0.0014889058656990528,0.07335901679471135,,,-0.11495555937290192,0.07556334882974625,0.19051890820264816,,,1.227957844734192,1.0881848335266113,-0.13977301120758057,,,0.3997255265712738,0.6092587113380432,0.2095331847667694,,
409,She understood that the practice violated campaign finance laws. She returned the excessive contribution.,She mailed the refund check. She returned the excessive contribution.,-0.11809715628623962,0.08018295466899872,0.19828011095523834,,,-0.12667812407016754,0.024579156190156937,0.15125728026032448,,,0.9260969758033752,1.7634111642837524,0.8373141884803772,,,0.2850826680660248,0.8656496405601501,0.5805669724941254,,
410,He recognized his duty to follow evidence preservation orders. He suspended the deletion policy.,He notified IT immediately. He suspended the deletion policy.,-0.0675198957324028,-0.020867979153990746,0.046651916578412056,,,-0.05274678394198418,0.09229034930467606,0.14503713324666023,,,0.7300803065299988,1.5689715147018433,0.8388912081718445,,,0.64385986328125,0.7502550482749939,0.1063951849937439,,
411,She felt obligated by the power of attorney document. She managed finances as directed.,She paid bills monthly. She managed finances as directed.,-0.022568395361304283,0.00528237409889698,0.027850769460201263,,,-0.044774379581213,0.21953843533992767,0.26431281492114067,,,1.6585317850112915,1.256663203239441,-0.4018685817718506,,,0.6520466208457947,1.082414150238037,0.43036752939224243,,
412,He understood that early release would violate the sentence. He served the full term.,He counted the remaining days. He served the full term.,0.05757006257772446,0.04969099536538124,-0.007879067212343216,,,0.06407620757818222,0.04371612146496773,-0.020360086113214493,,,1.6285151243209839,1.7569737434387207,0.12845861911773682,,,0.48199939727783203,1.0861177444458008,0.6041183471679688,,
413,She recognized her responsibility to comply with the consent order. She submitted quarterly reports.,She emailed them as PDFs. She submitted quarterly reports.,-0.04464250057935715,0.022832611575722694,0.06747511215507984,,,-0.11783508956432343,0.04973267763853073,0.16756776720285416,,,0.9818868637084961,1.4953097105026245,0.5134228467941284,,,0.25954964756965637,0.5558189749717712,0.29626932740211487,,
414,He felt bound by the intellectual property agreement. He assigned the patent rights.,He signed the transfer documents. He assigned the patent rights.,-0.09324519336223602,0.10323953628540039,0.1964847296476364,,,-0.10043957829475403,0.14996397495269775,0.2504035532474518,,,1.1906611919403076,1.3191243410110474,0.12846314907073975,,,0.7603186964988708,1.0278161764144897,0.2674974799156189,,
415,She understood that the practice violated student privacy laws. She redacted identifying information.,She used black markers. She redacted identifying information.,-0.12575849890708923,0.07428090274333954,0.20003940165042877,,,-0.09154608845710754,-0.0063857585191726685,0.08516032993793488,,,1.0004385709762573,1.662398099899292,0.6619595289230347,,,0.6881294846534729,0.955073356628418,0.26694387197494507,,
